"","Article","text"
"1","Article 1","July 15--Alabama Power Company is trying to beef up its ability to provide renewable energy in a bid to meet the demand of industries that require power from sources like wind, water and the sun.The company last month petitioned the Alabama Public Service Commission for authority to acquire up to 500 megawatts of renewable energy over the next six years, listing current and future customers as a main selling point.The company would either build  new equipment that would allow for renewable energy generation or buy such energy from other generators.""One of the things that we can be asked is what kind of offerings do you have as far as renewables,"" said Michael Sznajderman, an Alabama Power spokesman. ""We want to be able to provide these renewables.""The proposal, which was sent to the Public Service Commission on June 25th, would make Alabama more attractive to companies that want  or need renewable energy, Sznajderman said.""It could protect jobs, add jobs,"" he said. ""The more energy we sell, the better it is for our overall customer.""The news came out shortly after technology giant Google's June 25 announcement that it would build a new data center in Jackson County, where electricity is provided by the Tennessee Valley Authority. TVA's ability to provide renewable energy was important to Google's choice to come to Jackson County.""Google was very clear -- has been very clear --  that they want to power this new data center with renewable energy,"" said A.J. Jongewaard, a Google representative. ""They intend to power the facility with 100 percent renewable energy, and TVA was very receptive to that.""Sznajderman said Alabama Power's announcement wasn't in response to Google coming to Alabama in TVA territory, and that the dates were a coincidence.""We've been having conversations with our customers for some time about what their needs might be as far as renewables,"" he said.The proposal also mentioned military bases as important customers for this new energy. Federal guidelines are already in place that require renewable energy use at these bases, and Alabama Power hopes to meet that demand with this proposal, Sznajderman said.He also said the proposal would give Alabama Power plenty of latitude in the way it acquires this renewable energy.The plan outlines potential construction of permanent facilities, each of which would be restricted to generating no more than 80 megawatts of electricity, as well as the ability of the company to purchase energy from elsewhere.These deals are called Power Purchase Arrangements, and the company already uses them to bring in renewable energy from wind farms in the Midwest, Sznajderman said.""That's why the plan was written the way it was,"" he said. ""It gives us a wide latitude to figure out how to meet our customers' needs for renewables.""Some have criticized Alabama Power as being slow to move toward renewable energy, Sznajderman said. But there are several reasons for this, including that the company already had the resources it needed to meet its customers' demands, he said.""Unlike a lot of places ... we had no immediate need for additional generation,"" he said. ""We weren't in a mad rush ... We have always supported renewables where it makes sense to our customers.""The Public Service Commission has scheduled a public hearing on the proposal for Aug. 12. Anyone who wishes to intervene must send a petition to the commission by July 29.""We think we have a workable proposal,"" Sznajderman said. ""We're looking forward to the public hearing."""
"2","Article 2","After months of open speculation and exploratory meetings around the state, Miami state Sen. Annette Taddeo is making it official: she is running to be Florida's next governor.Taddeo, 54, filed campaign documents with Florida's Division of Elections on Monday morning. Her entry shakes up a Democratic field that has been so far dominated by two front-runners - U.S. Rep. Charlie Crist and Florida Agriculture Commissioner Nikki Fried - as they vie to challenge Gov. Ron DeSantis in 2022.""We need a governor who will actually govern,"" Taddeo told the Herald in an interview last week. ""We clearly have someone that is more concerned about being president than he is about running Florida, more worried about Republican primary voters in Iowa than he is about families here in Florida.""Taddeo is the only non-white gubernatorial candidate among the top contenders,in a state where Hispanics make up nearly 27% of the population, according to the Census Bureau's latest release in 2020 - a growth that accounts for almost 1.5 million new Latinos in the past 10 years. If she were elected as the Democratic nominee, she would be the first Latina candidate to earn a major party nomination for Florida governor. And if Orlando-area U.S. Rep. Val Demings becomes Sen. Marco Rubio's Democratic challenger in 2022, Florida's minority party would top the midterm ballot with two women of color.Taddeo says she's running as the grassroots candidate. Her candidacy would be a milestone for a party that has struggled with messaging to Florida Latinos in the past several elections, something Taddeo says she's confident she will be able to overcome by speaking directly with Hispanic and African-American voters to create a ""winning coalition"" for Democrats.A major factor that weighed into her decision to run, she explains, is her belief that ""candidates need to reflect the coalition"" Democrats want to create. It's not enough for Latinas to be surrogates or running mates or campaign managers, she says. They need to be the ones running, too.""I love how people work so hard and say, 'We want minority votes' ... because they know that the coalition to win is a coalition of diverse voters across the state for Democrats, and certainly it's something that we haven't tried before."" Taddeo said. ""But for us [women of color]to dare to actually be at the front of the bus instead of the back of the bus is somehow aiming too high.""Taddeo, a working mother with a 15-year-old daughter and two adult stepdaughters, said parents won't forget DeSantis' months-long feud with local school board members and the Biden administration over implementing mandatory mask use policies in public schools.""As a parent, and from all the parents I've heard from, I don't think that's something you forget,"" Taddeo said. ""When politics comes to the point that it's actually affecting your kids, it's a whole different ball game.""Taddeo says Medicaid expansion in Florida and addressing climate change will be two major themes of her campaign over the next 10 months ahead of the state's Aug. 23 primary election. But above all, she said she wants to address the crisis of parents, especially women, who have left the workforce during the COVID-19 pandemic and haven't returned.""It has become more expensive for parents to figure out who's going to take care of their kid while they go to work, and if it costs more than what you make, it makes it really tough,"" said Taddeo, who owns a business that provides a range of language services called cqLanguageSpeak. ""I know that businesses are aware of this issue, and I think we as a state should start investing more in helping those parents with that childcare and earlier education.""She said she'd like to push for the expansion of Florida's Voluntary Pre-Kindergarten program, which currently provides a free pre-K education for three hours a day for kids under 4 years old,to run for a full day.'Anything is possible'Rumors of Taddeo's potential run began circulating earlier this year as she discussed the possibility with Democrats in the Florida Legislature, Miami-Dade County and Washington. She's been meeting with Hispanic leaders across the state, including in Central Florida.Taddeo is well-known in South Florida, where she's a frequent guest on Miami's Spanish-language radio stations and stumped for national Democrats campaigning on her home turf.She's irkedfellow Democrats more than once in openly criticizing her party's late outreach and investments for Florida Latinos and their positions on Latin America policy.""The people that are within the Democratic Party, where I have been with them in the trenches, the ones who knock on the door, the ones who work and make the phone calls and really try to help elect Democrats, I do know that many of them respect me because I'm willing to speak out when we are not doing something right,"" said Taddeo.But Taddeo is lesser known than Fried, the only Democrat elected statewide in Florida in 2020, and Crist, a former Republican governor of Florida who registered as a Democrat in 2012- and two years later chose Taddeo as his running mate during an ill-fated attempt to win his way back into the governor's mansion.""I think for Senator Taddeo to be successful, she's going to have to occupy a lane and also have to capture the imagination of the Democratic electorate through messaging and herself and her story,"" said Miami-based Democratic pollster Fernand Amandi. But he warned that Taddeo has just 10 months to raise money against two better-funded candidates.Earlier this month, Taddeo's political committee, Fight Back Florida PAC, announced a slate of consulting firms that have run research, polling, ads and mail programs with Democrats in battleground races across the country. And on Friday, the committee announced a group of new hires who've worked on progressive causes and campaigns in Florida, including Jackie Lee, Biden's Florida state director in 2020, and Millie Raphael, who worked as Senior Hispanic adviser for former gubernatorial candidate Andrew Gillum. But her committee reported less than $250,000 on hand last month, a fraction ofwhat Crist and Fried have available to spend.""But as we saw in 2018,"" Amandi said, referring to the surprise Democratic gubernatorial primary victory of Gillum, an under-funded and embattled candidate, ""anything is possible.""Taddeo, who represents Florida's Senate District 40 in West Miami-Dade County, was first elected to her seat in a 2017 special election triggered by the resignation of state Sen. Frank Artiles, after it emerged he used a racist slur while speaking to Black colleagues in the Florida capitol. Taddeo, a Colombian American, became the first Democratic Latina elected to the Florida Senate.Prior to that victory, Taddeo had endured a string of losses. She ran unsuccessfully for Congress in 2008 and again in 2016, when former Congressman Joe Garcia beat her in the Democratic primary for Florida's 26th congressional district before losing in November to former U.S. Rep. Carlos Curbelo, a Republican. She lost a county commission race in 2010.Then in 2014, Taddeo was picked by her now-opponent Crist to be his running mate. That put her in position to become the state's first Latina lieutenant governor, a glass ceiling that was shattered four years later by Lt. Gov. Jeannette Nuñez.Crist choosing Taddeo helped - at least partially - to elevate her profile statewide. Previously a little-known business owner in Miami who wanted to improve her party's outreach of Latinos as the local chair of the Miami-Dade Democratic Party, she became a polished and formidable surrogate for Crist in Florida's Hispanic communities who was also taken seriously by Miami's Hispanic Republican leaders.""She's a remarkable woman and a classic American success story,"" Crist said in 2014 during his announcement. ""She truly is an American dream come true.""Though the bid was ultimately unsuccessful, headlines at the time describedTaddeo as an ""asset"" to Crist and an excellent fundraiser as he campaigned against the Republican incumbent, then-Gov. Rick Scott, whose lieutenant governor at the time was Carlos López-Cantera, a Cuban American from Miami-Dade.A Florida storyBorn in Barrancabermeja, Colombia in 1967, Taddeo fled to Alabama as a teenager with her family after her father, an Italian American from New Jersey, was briefly kidnapped by the Colombian FARC, a Marxist-Leninist guerrilla organization that Taddeo said had taken over her town and her family's farm.Still, she's not unfamiliar to attacks from Republicans calling her a communist. In the 2017 special state senate election, when her Republican opponent called her a sympathizer of socialist regimes in a campaign ad, Taddeo said she decided to be much more explicit about her background and her father's story.""It really was very upsetting, personally to me, to my mom,"" said Taddeo. ""One day I was shopping for uniforms for the next school year and the next day, I was in Alabama.""Taddeo hopes her ""Florida story"" will resonate with voters across the state.""My story is a story of believing in the American dream,"" she said. ""There's so many experiences in my life. Moving to Alabama and having to learn English but also living that very southern [life]in the Bible Belt of America and loving it, frankly.""Beyond a tough primary for Taddeo, Democrats are facing a scenario where they'll have to play catch-up with voter registration efforts, as Republicans ramp up their ground game.Democratshold an advantage of roughly 24,000 active, registered voters over Republicans. Little more thana decade ago, registered Democrats outnumbered Republicans in Florida by more than 500,000.Another issue for Democrats in the general election is addressing the swell of support that Republicans gained among Hispanic supporters throughout Florida in 2020, especially in Miami-Dade County.""Clearly, it's concerning,"" Taddeo said. ""But we also need to have the right people speaking to those voters about what it means to be a Democrat, why they should register Democrats, why they should vote for Democrats in a way that actually brings them towards us.""Fried and Crist have both been making early investments with Hispanic communities by meeting with leaders in the Cuban, Colombian, Puerto Rican and Venezuelan communities around the state.Debbie Mucarsel-Powell, a former Miami congresswoman who was the first South-American immigrant to serve in Congress, said she considers Fried, Crist and Taddeo to be good friends and she hasn't endorsed anyone in the race.But she did say she recognized the importance of Taddeo jumping into the gubernatorial race.""I really think that we need more Hispanic women in positions of power,"" said Mucarsel-Powell. ""The Hispanic vote is going to be extremely important in 2022 and all election cycles and the candidate that can speak to the Hispanic community the best is going to have a better chance of moving them and getting them to turn out in the future election."""
"3","Article 3","President Joe Biden is entering a crucial two weeks for his ambitious agenda, racing to conclude contentious congressional negotiations ahead of both domestic deadlines and a chance to showcase his administration's accomplishments on a global stage.Biden and his fellow Democrats are struggling to bridge intraparty divides by month's end to pass  and . The president hopes to nail down both before Air Force One lifts off for Europe on Oct. 28 for a pair of world leader summits, including the most ambitious climate change meeting in years.Biden is trying to stabilize his presidency after a difficult stretch marked by , a diplomatic spat with a longtime ally and a surge in COVID-19 cases that rattled the nation's economic recovery and .The president's goals have been jeopardized by fractures among Democrats, imperiling the fate of promised sweeping new efforts to grapple with . There's also rising anxiety within the party about  and looming Senate fights over  and government funding that could distract from getting the president's agenda across the finish line.Biden's team has continued its strategy - one that served it well during the campaign and earlier this year - of blocking out the outside noise to stay focused on a singular mission, this time to pass the two-part package that will give Democrats a platform on which to run in next year's midterm elections.""These bills, in my view, are literally about competitiveness versus complacency, about opportunity versus decay, and about leading the world or continuing to let the world move by us.""""These bills, in my view, are literally about competitiveness versus complacency, about opportunity versus decay, and about leading the world or continuing to let the world move by us,"" Biden said Friday while pushing the legislation in Connecticut.Yet beneath the White House's pleas for patience - reminding people that hard things take time - is a bubbling sense of urgency that a deal needs to be struck rapidly.For the White House, there are the explicit target dates, including an end-of-month deadline on transportation funding and Biden's upcoming foreign trip. But there are also more abstract imperatives: proving Democrats can deliver on their promises to voters and protecting Biden's waning political capital.President Biden has expressed impatience and will be increasing his own personal outreach this week to pressure lawmakers to find a compromise and bring the bills to a vote.With new urgency, the administration has sent signals to Capitol Hill in recent days that it is time to wrap up negotiations, that a deal needs to be reached, according to two White House officials who spoke on condition of anonymity because they were not authorized to publicly discuss private conversations. Biden himself has expressed impatience and will be increasing his own personal outreach this week to push lawmakers to find a compromise and bring the bills to a vote, the officials said.West Wing officials are still optimistic that an agreement will ultimately be struck, but there are also fears that the messy, drawn-out negotiation has clouded the tangible benefits of what Biden aims to deliver to voters.Biden sought to address some of that when he traveled to Hartford, Connecticut, last week to showcase initiatives to sharply reduce the cost of early childhood care - perhaps one of the only pieces of the legislation that is a lock to make the final package.Even Democratic leaders are divided on the best way to shrink the overall price tag of the package in order to win over more votes. Biden said Friday he prefers including all of the wish-list proposals, but trimming down the length of the programs to cut costs. His thinking is that a future Congress can vote later to extend programs that the American people will find popular.But days earlier, House Speaker Nancy Pelosi suggested the opposite tack - approving a narrower set of programs to last for a longer time period.Some Democrats have pushed for passing the bipartisan infrastructure deal by Oct. 31 even if the larger social services package is not settled, a move many progressives dislike because they could lose leverage for the latter bill.The fate of climate change provisions is particularly perilous.West Virginia Sen. Joe Manchin's objections to a program aimed at speeding the nation's transition away from fossil fuels threatens the heart of Biden's plans to combat climate change just before he tries to assert American leadership on the issue at the upcoming global conference in Scotland.The Democrats' razor-thin margins in both houses of Congress have empowered individual lawmakers like Manchin and Arizona Sen. Kyrsten Sinema, vexing fellow lawmakers and the White House. White House aides have not abandoned the clean energy program but are exploring alternate means to string together a mix of policies to cut emissions, officials said.Abandoning the provisions could wound Biden in Glasgow, at a summit that the administration has held out as a vital opportunity not just to combat climate change but to reassert U.S. leadership on the issue after four years of retrenchment under President Donald Trump. The United States will be bringing a major footprint to the gathering - including former President Barack Obama - but it risks falling behind European nations that have taken more concrete steps to cut emissions.Biden's stop in Scotland early in November will follow his participation in a summit of world leaders in Rome. But Chinese President Xi Jinping's decision to skip the gatherings - delaying the first meeting between the leaders of the two superpowers - could diminish their relevance.Still, Biden is expected to meet in Italy with French President Emmanuel Macron as the men look to repair relations after a U.S. submarine deal with Australia scuttled a French contract and led the French to briefly withdraw their ambassador from Washington.Also looming is the Nov. 2 gubernatorial election in Virginia, which is regarded as a referendum on Biden and the Democrats' chances of retraining control over Congress next year.Terry McAuliffe, who previously served as the state's governor, is locked in a closer-than-expected race with Republican businessman Glenn Youngkin in a state that Biden won by 10 points last year.McAuliffe has been surprisingly public in his criticism of the administration's legislative strategy, urging Democrats to pass the infrastructure bill before Election Day to give him something to show voters. White House officials privately expect McAuliffe to emerge with a narrow win and believe they can ignore worries about a smaller-than-expected margin of victory.But a tight outcome, or a Youngkin win, could rattle Democrats uncertain about Biden's political coattails - potentially making them less likely to take risky votes for his agenda - and would buoy Republicans heading into the midterms."
