"","Article","text"
"7","Article 7","Fewer tornadoes, lakes you can wade across, earlier springs and longer growing seasons - obviously, global warming has come to Oklahoma. Right?Well, perhaps.  But whether all this stuff was caused by worldwide climate change, who knows? For one thing, nothing's for sure in science.""We don't even know for certain that the sun's going to rise tomorrow,"" David Karoly said.Before you stock up on flashlights, remember that scientists tend to be very conservative. Science is the practice of observing what you can, then drawing conclusions that best explain those observations. Take that sun thing, for instance. From what scientists have learned to this point, most are confident enough to bet their bottom dollar that the sun will come up tomorrow.""It's very likely to,"" said Karoly, University of Oklahoma meteorologist who studies climate change.Also, as a recent report from a United Nations panel on climate change stated, scientists worldwide are confident - maybe not to the level of the sunrise theory, but pretty darn sure - that the Earth is getting warmer. Also, they say, it's ""very likely"" that greenhouse gas emissions produced by people are the cause.Still, it's not clear whether global warming or just normal fluctuations in climate are causing various changes in Oklahoma lately. That's because it's hard to tell what causes small-scale things over short periods, scientists say. By ""small-scale"" in the global sense, scientists mean things happening over one state or even a region, and by ""short periods,"" they mean within a few years.For changes happening over decades or longer and over large areas, such as the entire country or the continent and during the past 30 years or more, it's different. ""We can say with high confidence that the warming average across North America is due to increased greenhouse gases,"" Karoly said.Meanwhile, many other scientists and naturalists are noting changes in animal behavior or plant growth on the small scale. But tying those to global warming? That's another thing.Craig Davis has been closely watching birds, particularly migrating shorebirds passing through western Oklahoma. Ponds, bogs, swamps and lakes across the Great Plains form ""steppingstones of wetlands"" that the birds follow, providing vital stops on their long journeys north, he said.But for whatever reason, a changing climate has been drying up many of those ""white dots"" birds search for along their flyways, said Davis, assistant professor of wildlife conservation at Oklahoma State University. ""We don't want to lose any more steppingstones.""I wouldn't say we're seeing great, great changes,"" he said. ""But the concern is we are starting to see the beginnings of some of these changes.""Allan Storjohann has noticed many tropical ornamental plants doing fine here. Not long ago, those plants could not survive Oklahoma's winters. Yet, some agave, yuccas and palms that once were rarely seen north of Dallas have become favorites of landscapers across this state, he said. ""We're seeing plants we thought might be killed out there.""But even that apparently is no indication of warming, the global kind anyway. Sure, summers around here lately have been warmer, just like winters in recent years, except for the current one. But those, too, could be normal fluctuations of temperature, researchers say. More easily attributed to planetary warming, Karoly said, would be the ""quite pronounced"" warming trend in Oklahoma over the past few decades.""Earlier springs, fewer frosts, warmer nighttime temperatures - those sorts of things have been happening with greater regularity or with greater magnitude over the last 30 years,"" Karoly said.Oklahoma's tropical plant influx also might be just that breeders have developed hardier versions, said Storjohann, ornamental horticulturist and manager of the Myriad Botanical Gardens. ""They're new selections of plants,"" he said.Joseph Bidwell has seen some zebra mussels disappearing from Skiatook Lake, not that he's sorry to see these invasive mollusks go. But it appears the recent warmer temperatures and low water flows have taken a toll on the annoying bivalves, said Bidwell, associate professor of zoology at OSU.""Is that due to global warming?"" he asked. ""I can't say.""Data from much longer periods would be needed to determine that, he said.Scientists can hypothesize (science-speak for making an educated guess) about what might be expected if global warming progresses as it's expected to. Plants would, as it appears they have been doing lately, tend to bloom earlier and have longer growing seasons. For some people, a slight warming could be profitable, Karoly said. Farmers, for instance, particularly those in the Northern Plains, could plant earlier and enjoy longer growing seasons.""If temperatures continue to rise, if rainfall patterns change, there may be added problems,"" he said.Scientists expect continued global warming to push the jet stream and the main rainfall-bearing systems northward, making that region wetter and more prone to storm activity than the Southern Plains. However, Oklahoma's recent dry spell and drop in tornado activity could be just natural fluctuations in weather, scientists say.If those local patterns continue over many years, researchers might be able to tie them to global warming, Karoly said.Meanwhile, researchers will continue watching and measuring and observing. And the public will keep wondering and asking why things are happening in their state - even if it's hard for scientists to bet their bottom dollar on a clear explanation. Bidwell hopes people don't assume that because scientists don't have ""absolute, definitive"" answers to all questions, global warming isn't happening or isn't a problem.""That's what the frustration is,"" he said."
"8","Article 8","Feb. 11--A special team at Owensboro Municipal Utilities studying solar options for producing or obtaining electricity is scheduled to present its findings to the utility's board on Thursday, but Aloma Dew is being careful not to set her hopes too high.""I have not seen a lot of enthusiasm from OMU for sustainable and renewable energy,"" said Dew, a representative of the local Sierra Club and a long-time environmental activist. ""I hope I'll be pleasantly surprised. But I fear OMU is going with natural gas. It's cleaner than coal, but frankly it is not sustainable or renewable. But in the short term, it may be necessary.""A shift to natural gas generation of electricity figures to be expensive, Dew said, and she fears that will mean the utility will not be able to also invest in renewable energy, such as solar.""I think the most reasonable expectation is that they will do a mix and begin to move toward sustainable-renewable energy,"" Dew said. ""We are all anxious to hear what they have to say.""Dew said she plans to invite OMU General Manager Terry Naulty to attend the local Sierra Club's meeting in March to talk to the membership about OMU's plans to include renewable resources in its energy portfolio.One option for OMU may be to lease solar energy capacity, Dew said.Sonya Dixon, OMU's spokeswoman, said the plan remains for the solar study team to makes its report at the 11:30 a.m. meeting of the City Utility Commission on Thursday. The meeting, which is open to the public, will be held at the OMU Customer Service Center, 2070 Tamarack Road.Based on its most recent staff recommendation, OMU appears on the verge of severing its ties to coal-fired generation and adopting natural gas as its main fuel for generating electricity, either by building its own natural gas power plant or by partnering with an existing or new natural gas utility. But the utility is looking at ways to incorporate renewable energy, namely solar, into its generation portfolio.In late December, Naulty said the solar team was assigned to evaluate three potential solar generation options.""The three options include: 1, self-development of a solar facility; 2, building a community solar project in which customers could lease solar panels from OMU and use the energy generated to offset their energy use consistent with OMU's net metering tariff; and 3, contracting with a third party to build a solar facility which would be owned by private equity and from which OMU would purchase the energy and capacity under a long-term power purchase agreement.""For all three options, the team will be providing an assessment of integration costs and the potential electric rate increases to customers if the Utility Commission and Owensboro City Commission were to approve, said Naulty.Naulty said that while the cost of solar energy continues to drop, it is still more expensive than conventional energy production methods.Austin McLimore, OMU's manager of engineering, is leading the solar team.In early December, the OMU staff recommended to the OMU board that the utility eventually cease coal-fired generation at the Elmer Smith Station power plant, based on a study that concluded that continuing to burn coal at the plant on Kentucky 144 will no longer be the most economical method of producing power in the face of ever-climbing regulatory costs associated with coal-fired generation and the availability of abundant, relatively cheap, cleaner-burning natural gas. Since then, the board ordered an outside review of the study's findings."
"9","Article 9","Libertarian presidential candidate Bob Barr just finished up on Comedy Central's ""The Colbert Report.""If and when the segment is parsed, we'll add a video link in this space.It's clear that Barr is having an impact in a number of states --- including New Hampshire and Colorado, where Zogby polls show him over 10 percent --- and could make a difference in others, including Florida.The problem at Comedy Central is that stuff is always about to get interesting, then veers off. Here's one exchange:Colbert: Do you guys believe in global warming?Barr: Global warming is a fact, but we believe that the market ought to take care of it, not the government.Colbert: I agree. I say let the market decide what is and isn't a glacier.Barr: And if people want to make ice cubes out of it, that's up to them.Colbert: Now, you at one point said global warming was not a fact. And then, this summer, you went to one of Al Gore's ...events in Washington, and you came out of it and said that global warming is a reality, as most every organization who has studied the matter has concluded.What changed your mind about what happened, that weekend?Barr: Actually, I had a very nice session at Al Gore's house a few days before that. But that didn't really change anything. We did have a good cigar, by the way, at his house.Colbert: You and Al had a good cigar?Barr: Actually, we did.Colbert: A different cigar. Not one cigar.Barr: No...Colbert: You weren't working your way toward the center.Barr: That would be difficult.Colbert: That would be difficult, but fun to watch.....Barr did get a plug in about the polling, and concluded with another Zogby stat indicating that 55 percent of Americans think that Barr (and Ralph Nader) should be included in the presidential debates."
"10","Article 10","A final report by the Southern Appalachian Mountain Initiative (SAMI) group has found that much of the air pollution in state and federal parks in the Appalachian region is caused by local power plants and other emission sources and is not imported from distant regions.But the SAMI group, which represents agencies from eight states in the region, held back from calling on the individual states to adopt new emission reduction rules for power plants and instead called for national multi-pollutant legislation to protect sensitive forest areas.SAMI said that states should take an initiative to cut pollution on the regional level only if national legislation failed to materialize."
"11","Article 11","Whether or not climate change leads to an increase in big hurricanes, one destructive effect of global warming is already at work in coastal Virginia -- rising sea levels.As sea levels go up, flooding from even low-level storms will become more destructive, scientists say.""At times I think we get too locked in on the strongest storms, the Category 3, 4 and 5s,"" said Marshall Shepherd, a University of Georgia atmospheric scientist. ""But if you look at the last five or 10 years, even the weaker storms can create a lot more damage.""Hurricane Isabel is a perfect example of this growing threat. To understand this, we need to look first at another storm.The worst hurricane to hit southeastern Virginia in modern times was a 1933 storm whose center rolled northwest directly over Norfolk. It was a Category 1 hurricane, with winds reported at nearly 90 mph.Called the Chesapeake-Potomac hurricane, the legendary storm pushed up record high tides along the west side of the Chesapeake Bay, ""with damages the highest ever recorded from a storm surge,"" according to the state Department of Emergency Management website. Eighteen people died.Isabel in 2003, the center of which traveled northwest through central Virginia, weakened from a hurricane to a tropical storm about the time it hit the state, but it still caused $1.6 billion in damage, destroying homes, piers and other structures and contributing to more than 30 deaths in the state.While less powerful overall than the '33 hurricane, Isabel caused similar flooding because the sea level had risen 9 to 10 inches in the years between the two storms, scientists said.That gave Isabel extra destructive power, enabling it to push its storm surge inland on higher waters.As sea levels continue to rise, bad coastal flooding should get more common, said Larry P. Atkinson, an Old Dominion University oceanographer.""What statistically happened every 100 years will happen every 80, then 50, then 20 and so on,"" Atkinson said.Sea-level rise is caused at least in part by global warming, because warm water expands. In Virginia, sea levels are rising faster than the global average because the land is sinking, primarily from natural causes.For thousands of years, the sea level in Virginia went up about a foot a century. At least partly because of global warming, experts say, that rate increased during the 20th century, and waters are rising now at about a 2-feet-a-century clip. And some scientists say there's evidence that sea levels will rise faster and faster in coming decades.Celia and Jim Sease have a house along Mobjack Bay in low-lying Mathews County. Floodwaters from Isabel lapped at a door of their home, and the storm ""pretty much destroyed"" a nearby vacation rental house they owned at the time, flooding it with about 2feet of water, Celia Sease said.Sease said she can't detect the rising sea level, but she has noticed an apparent increase in flooding in recent years. ""I don't know what the reason is. ... It just seems like there's a lot more flooding now from just normal rains.""Flooding is indeed getting worse in coastal Virginia, said a January report from the Virginia Institute of Marine Science.For example, a low-lying Norfolk neighborhood called the Hague, which flooded fewer than 25 hours a year in the late 1920s, flooded 200 to 300 hours a year in the mid- to late 2000s.Also, people continue to build near Virginia's coast, putting themselves and their property at risk.Doug Dwoyer, a former NASA manager who lectures on climate change, said that coastal buildup means ""economic damage from hurricanes will continue to increase even without increases in hurricane strength and/or frequency."""
"12","Article 12","Rising sea levels are expected to impact $916 billion worth of homes in the next 0 years, most of which are low-end or median-value homes.Zillow analyzed the types of homes that could be underwater, absent preventative measures, based on recent estimates of how high sea levels could rise by 20 due to climate change.The majority of all homes at risk of flooding due to rising sea levels are in suburban areas  65.4 percent of homes are in suburban areas, compared to 22.6 percent in urban locations and 12 percent in rural areas.Overall, 39 percent of the homes expected to be underwater in 20 are among the nation's most valuable. The rest are near the median value or below  and a quarter are among the least valuable homes. This is significant because less wealthy communities and households are less likely to be able to afford preventative measures to ward off rising seas. For most homeowners, a home is their biggest single investment, and its value is a major share of their overall wealth. Any significant damage to a home is harder to recover from when most of an owner's wealth is tied up in that same home.Owners of high-end homes are more likely to live in communities with the resources and connections needed to protect their homes, such as building sea walls or making structural changes that help homes withstand floodwaters. But in markets where the majority of homes at risk of rising water are among the least valuable in the area, these options might be out of reach.Less than 20 percent of homes in Honolulu that are at risk of flooding due to rising sea levels are high-end homes. That means the majority of homeowners who could lose their homes may be less able to make investments to protect their properties, especially lower income homeowners who have to spend a larger share of their income on mortgage payments.""We've seen the enormous impact flooding can have on a city and its residents,"" said Zillow Chief Economist Dr. Svenja Gudell. ""It's harder for us to think about it on a long-term timeline, but the real risks that come with rising sea levels should not be ignored until it's too late to address them. With organized and committed planning, cities can help protect both current and future residents. Living near the water is incredibly appealing for people around the country, but it also comes with additional considerations for buyers and homeowners. Homes in low-lying areas are also more susceptible to storm flooding and these risks could be realized on a much shorter timeline as we have seen time and time again.""Miami holds 25.8 percent of all U.S. homes at risk of rising sea levels, which are cumulatively worth $217.3 billion. The three cities with the greatest number of homes threatened by higher sea levels are in the Miami metropolitan area. Fort Lauderdale, Miami Beach and Miami could all lose more than 30,000 homes to sea level increases."
"13","Article 13","By Seth Borenstein The Associated PressWASHINGTON - Melting ice sheets in Greenland and Antarctica are speeding up the already fast pace of sea level rise, new satellite research shows.At the current rate, the world's oceans on average will be at least 2 feet higher by the end of the century compared to today, according to researchers who published in Monday's Proceedings of the National Academies of Sciences.Sea level rise is caused by warming of the ocean and melting from glaciers and ice sheets. The research, based on 25 years of satellite data, shows that pace has quickened, mainly from the melting of massive ice sheets. It confirms scientists' computer simulations and is in line with predictions from the United Nations, which releases regular climate change reports.""It's a big deal because the projected sea level rise is a conservative estimate and it is likely to be higher, said lead author Steve Nerem of the University of Colorado.Outside scientists said even small changes in sea levels can lead to flooding and erosion.""Any flooding concerns that coastal communities have for 2100 may occur over the next few decades, Oregon State University coastal flooding expert Katy Serafin said in an email.Of the 3 inches of sea level rise in the past quarter century, about 55 percent is from warmer water expanding, and the rest is from melting ice.But the process is accelerating, and more than three-quarters of that acceleration since 1993 is due to melting ice sheets in Greenland and Antarctica, the study shows.Like weather and climate, there are two factors in sea level rise: year-to-year small rises and falls that are caused by natural events and larger long-term rising trends that are linked to man-made climate change.Nerem's team removed the natural effects of the 1991 Mt. Pinatubo eruption that temporarily chilled Earth and the climate phenomena El Nino and La Nina, and found the accelerating trend.Sea level rise, more than temperature, is a better gauge of climate change in action, said Anny Cazenave, director of Earth science at the International Space Science Institute in France, who edited the study. Cazenave is one of the pioneers of space-based sea level research.Global sea levels were stable for about 3,000 years until the 20th century when they rose and then accelerated due to global warming caused by the burning of coal, oil and natural gas, said climate scientist Stefan Rahmstorf of the Potsdam Institute in Germany, who wasn't part of the study.Two feet of sea level rise by the end of the century ""would have big effects on places like Miami and New Orleans, but I don't still view that as catastrophic because those cities can survive - at great expense - that amount of rising seas under normal situations, Nerem said.But when a storm hits like 2012's Superstorm Sandy, sea level rise on top of storm surge can lead to record-setting damages, researchers said.Some scientists at the American Geophysical Union meeting last year said Antarctica may be melting faster than predicted by Monday's study.Greenland has caused three times more sea level rise than Antarctica so far, but ice melt on the southern continent is responsible for more of the acceleration.""Antarctica seems less stable than we thought a few years ago, Rutgers climate scientist Robert Kopp said."
