"","Article","text"
"4","Article 4","Anne Arundel County continues to have unhealthy levels of air pollution, posing health risks to sensitive residents, according to a report issued today.The American Lung Association gave the county a grade of F for smog and D for soot pollution in its annual ""State of the Air"" report. Anne Arundel also squeaked out a ""pass"" on a pass/fail measurement of year-round soot pollution.Overall, the Baltimore-Washington metro area ranks 14th-worst nationally both for daily smog pollution and daily soot pollution.The lung association report measures two types of pollution: smog, also known as ground-level ozone; and soot, also called particulate matter. The report issued today covered the years 2005 to 2007 and is based on government data.Ozone occurs when hot air, sunshine and airborne pollutants combine. Ozone contributes to decreased lung function, respiratory infections, lung inflammation and worsening of lung problems.Particulate matter, tiny bits of solid and liquid pollution in the air, also causes health warnings and health problems, including increased hospital visits for asthma and heart patients, according to the lung association.""Air pollution is serious,"" said Dr. Norman H. Edelman, chief medical officer for the lung association.Air pollution is caused by emissions from gasoline and diesel vehicles, coal-burning power plants and other sources.Despite the poor grades, state environment officials said Maryland's air pollution is decreasing.""We've made some progress, but we still have a ways to go,"" said Tad Aburn, the top air-quality official at the state Department of the Environment. ""The reality is, the air Marylanders breathe is a whole bunch cleaner than 10 years ago.""Aburn, who was attending a multistate meeting about power-plant pollution yesterday, said Maryland needs to continue to cut down on pollution from local sources as well as work with neighboring states. On some days, 50 percent to 70 percent of Maryland's air pollution blows in from the Ohio Valley.Maryland lawmakers have taken steps to combat air pollution.The Healthy Air Act, passed in 2006, requires pollution controls at power plants, some of which already have been installed. And the Clean Cars Act of 2007 will eventually require more low-emissions cars to be sold here.Those laws and other programs should result in better pollution scores in the future, Aburn said.Charles D. Conner, CEO of the lung association, said the report underscores the importance of fighting air pollution, even as the nation wrestles with other urgent, related issues such as global warming and energy independence.""We still must recognize the problems we have with old-fashioned air pollution,"" he said.The report mainly looks at how often air quality alerts such as ""code orange"" and ""code red"" are issued to warn sensitive people to stay inside because of high levels of soot or smog. Those alerts are issued mostly in the summer, when hot air and sunlight make the effects of pollution worse.The lung association offered ideas for improving air quality: require pollution controls at coal-burning power plants, clean up the nation's diesel trucks and buses, clean up dirty oceangoing ships, and tighten pollution regulations.Individuals can take action by driving less and using less electricity, not burning wood or trash, lobbying for cleaner buses, and getting involved in pollution policy, officials said.This is the 10th year for the ""State of the Air"" report, which initially gave grades only for smog. Soot was added later.If you're looking for a place with air that's easier to breathe, the lung association says Fargo, N.D., has the cleanest air in the nation. How we rank:The American Lung Association annually ranks cities, counties and regions on air quality. The rankings are based on data collected by the U.S. Environmental Protection Agency. The 2009 report is based on data from 2005 to 2007.Here's how Anne Arundel County scored:SMOGOzoneGrade: F48 code orange days, 2 code red days, 1 code purple day.Weighted score: 17.7, fifth-worst in Maryland.SOOTShort-term particle pollutionGrade: D7 code orange daysWeighted score: 2.3, fourth-worst in Maryland.ANNUAL PARTICLE POLLUTIONGrade: PassScore: 14.3 (15 or greater is failing), third worst in Maryland.Queen Anne's County is not ranked because it does not have an air-quality monitoring station."
"5","Article 5","Dec. 11--Drought conditions have dried out the North Fork of the Edisto River but Orangeburg Department of Public Utilities officials say the situation has yet to reach a critical point.DPU, which is a primary source of drinking water for the city and surrounding environs, is keeping an eye on low water levels.""The drought is bad for everybody,"" DPU manager Fred Boatwright said. ""We are certainly concerned about the drought but the river level right now is not a problem for us.""Boatwright said in his experience the river tends to fall to a plateau level in which it holds steady through the support of groundwater.""We are still in good shape,"" Boatwright said. ""But I still want it to rain. If I could do a rain dance I would.""Through Dec. 7, the Edisto River elevation was 153.1 feet above sea level, which is about two feet above, the 85-year record low.The level is up from 152.4 feet seen in October and up 152.1 feet above sea level in June. The lowest the river has ever been is 151.5 feet during the last drought in August 2002.Stream flows this past week along the Edisto through the city were around 172 million gallons. During the severe drought in 2002, the flow was averaging about 90 million gallons.The utility requires about 8.5 million gallons a day to provide an adequate water supply for its customers.DPU spokesman Randy Etters said the utility monitors stream flows daily with the utility having a benchmark in place when the river reaches a level of about 151.6 feet above sea level and stream flows less than 125 cubit feet per second.The ordinance is based upon the South Carolina Drought Response Act issued by the Department of Natural Resources and consistent with the state's water plan.""We have been very fortunate,"" Etters said. ""Our equipment has been functioning properly and well within the tolerance level.""The Friends of the Edisto, a river advocacy group, during its monthly meeting Thursday night at the Orangeburg Fatz Cafe expressed its concerns about the falling river levels.""The water table is now below the river so the river is now recharging the water table,"" said Bill Marshall, acting chair of FRED.South Carolina Department of Natural Resources hydrologists estimate the river is losing about 60 percent of its water where the North Fork and the South Forks meet.In an article appearing in the Dec. 2 edition of The State, DNR chief hydrologist Bud Badr says the underground water table appears to be sinking into the ground in part due to the impact of the drought about five years ago.He says usually the downstream volume of the Edisto is much greater than the sum of its upstream branches with the volume increasing as small tributaries join the river and the water table also seeps water into the Edisto.Badr said the phenomena is not typical for inland systems like the Edisto.Tim Rogers, founding FRED member, inquired if there were any proposals or legislation underway to help permit or restrict withdrawals from the river.""One of the good things about the Edisto is that historically there have not been a lot of withdrawal points,"" he said, noting that what happens to withdrawal levels when a drought is in place. ""A least it would be nice if we had some set of rules.""Rogers, who has a residence by the river, said 'you can't put a boat in and you can't move it up and down the river.""""Fishing is down,"" he said.Fish biologists with DNR have said water levels have resulted in reduced fish habitats that could lead to reduced fish populations if adequate winter and spring rains do not arrive.The National Drought Mitigation Drought Monitor Index through Dec. 4 revealed most of Orangeburg County is in a severe drought with the exception of the western end of the county around Springfield which is classified as in an extreme drought.The ranking is the third level of drought severity on a scale of five, with five classified as an exceptional drought.The town of North and Eutawville have a voluntary water restriction issued Oct. 31 and Nov. 12, respectively, according to the DNR Water Conservation Web site.The Silver Springs Water District also issued a voluntary restriction on Sept. 7.Most of Calhoun County is also in the severe category, with the exception of the Sandy Run area near Columbia, which is classified as extreme. There are no water restriction advisories in Calhoun County.In Bamberg County, the index revealed most of the county in a severe drought, with the exception of the Denmark area, which is extreme.According to the DNR Web site, the most recent water restrictions include the town of Govan which has a voluntary water restriction.The South Carolina Drought Response Committee, made up of various state and local agencies, monitors the drought conditions, and convenes when deemed necessary if more rain or the lack of causes a change in water conditions.In the meantime, DNR is encouraging all to conserve water during this time.Statewide, the Piedmont area has been hit by the drought most extensively, while the coastal plain near Hilton Head and Beaufort is classified as a moderate drought.Overall, things do not look any better for the Southeast.The National Oceanic and Atmospheric Administration forecasts the region likely will remain drier than average because of La Nina, while temperatures are expected to be above average through the winter.La Nina is defined as cooler-than-normal sea-surface temperatures in the central and eastern tropical Pacific Ocean that impact global weather patterns. La Nina conditions recur every few years and can persist for as long as two years."
"6","Article 6","Skeptics about global warming often focus on computer models of the world's climate, criticizing the models as inaccurate and contradictory. $TSurprisingly, scientists agree. Even the most powerful and sophisticated model, they say, produces only an educated guess about the climate of the future. For that reason, scientists stress that models do not produce predictions. They prefer the term ""scenarios."" $T""Scenarios are plausible alternative futures --- each an example of what might happen under particular assumptions,"" U.S. scientists cautioned in a report released in April. ""Scenarios are not specific predictions or forecasts."" $TMost computer scenarios agree that if the amount of carbon dioxide in the atmosphere doubles as expected by the end of the century, the gas will serve like a pane of glass in a greenhouse, trapping solar heat that otherwise would escape into space. But the models disagree on the details, including how much warming is likely. $TReflecting that range, the Intergovernmental Panel on Climate Change, made up of hundreds of scientists from around the world, this year predicted a temperature rise of 2.5 to 10.4 degrees by the end of the century. $TModeling the climate is difficult because of the interaction of many factors: ocean currents; jet streams; cloud cover; solar activity; airborne particles; and physical features such as mountains and deserts, just for starters. Climate modelers try to mimic that complex interaction in a supercomputer. $TThe models are tested for accuracy by matching them up against history. The computer is asked to project the climate for a certain time frame, and the results are compared with the climate that actually occurred.AJC$TIf there's a discrepancy, modelers go back to the drawing board. $TIn April, the National Science and Technology Council, a panel of American scientists, released a report on the possible impact of global warming on the United States. To their chagrin, the scientists were forced to rely on models developed by scientists at the Hadley Centre for Climate Prediction and Research in Britain and the Canadian Centre for Climate Modeling and Analysis in Victoria, British Columbia. $TU.S.-based models simply weren't as sophisticated and accurate, in large part because of inadequate government funding. In a subsequent report, the National Academy of Sciences told President Bush that ""the ability of the United States to assess future climate change is severely limited by … inadequate computational resources, and by the general inability of government to focus resources on climate problems."" $TIn parts of the country, the Hadley and Canadian models are in rough agreement. But they disagree dramatically about the Southeast. The Hadley model projects a warmer and slightly wetter future, with serious but manageable impacts; the Canadian model projects a much warmer and drier climate, with almost calamitous effects. $T""We really don't know what will happen in the future,"" says Shrikent Jagtap, a researcher at the University of Florida trying to assess the impact of climate change on agriculture in the Southeast. ""We can only go by what happened in the past. You ask, 'Can these models re-create what happened in the past?' The problem is, both of them do.""Graphic by DALE E. DODSON / Research by JAY BOOKMANGraphicGraphic:PROJECTED WARMINGBoth the Hadley and the Canadian models predict significant increases in temperatures globally and nationally over the next century. Heat index predictions are more dire, reaching up to +25 in the Canadian model.................Hadley model… Canadian modelGlobal........… +5................+5United States......+8................+9Source: ""Climate Change Impacts on the United States,"" prepared by the National Science and Technology Council Map:HOW VALID ARE THE COMPUTER PROJECTIONS?To improve the accuracy of climate models, scientists compare their computer projections with real-life weather records. In this case, when the Canadian and Hadley computer models projected the annual average temperature in the United States from 1961 to 1990 (below left), they predicted outcomes similar to what took place.Three maps show the projected annual average temperature in the United States according to the observed climate and computer models:Observed climate, 1961-90 averageCanadian climate model, 1961-90 averageHadley climate model, 1961-90 average Map:TEMPERATURE RISINGIn the 20th century, temperatures in the United States remained largely steady, with a cooling of about 1 degree in the Southeast. In the 21st century, however, the Canadian model projects an increase of 9 to 10 degrees in most of the United States, while the Hadley model predicts a more moderate increase of about 5 degrees.Three maps show the projected annual increases in temperature in the United States according to the observed climate and computer models:Observed temperature, 20th centruyCanadian temperature model, 2100Hadley temperature model, 2100 Map:HOTTER, MORE SULTRY SUMMERSThe rising temperatures projected in the Hadley and Canadian scenarios would increase evaporation, leading to much more humidity. As a result, the July heat index --- a figure that combines heat and humidity and reflects how hot it feels --- rises 8 to 15 degrees in the Hadley model and 25 degrees or more in the Canadian model.Two maps show the projected annual heat index in the United States according to computer models:Canadian heat index model, 2100Hadley heat index model, 2100 Map:LESS PRECIPITATIONWith hotter weather and increased evaporation, rainfall becomes increasingly critical for the survival of plants and aquatic life. The Canadian model projects a slight decline in rainfall, which, combined with much hotter temperatures, would dry the soil and greatly reduce water in Southeast streams. The Hadley model projects a small increase in rainfall, resulting in small declines in soil moisture.Two maps show the projected annual precipitation in the United States according to computer models:Canadian precipitation model, 2100Hadley precipitation model, 2100 Map:WITH FEWER TREES, GEORGIA MORE LIKE TEXAS?The Southeast, including Georgia, is dominated by a mixed forest of pines and hardwoods (bottom left). If temperatures rise and rainfall drops, as suggested in the Canadian model, most of the state's coastal plain changes to open grassland much like that of Texas or Nebraska. Most of the northwest third of the state changes to a savanna-woodland mix similar to that of North Florida. According to the Hadley model, there would be warmer temperatures but more rain, and therefore little change in the ecosystem.Three maps show the curent and projected ecosystmes in the United States according to computer models:Current ecosystemsCanadian ecosystems model, 2100Hadley ecosystems model, 2100The ecosystems displayed are:TundraTaiga/tundraConifer forestNortheast mixed forestTemperate deciduous forestSoutheast mixed forestTropical broadleaf forestSavanna/woodlandShrub/woodlandGrasslandArid landsSource: Mapped Atmosphere-Plant-Soil System, a computer model developed by Ron Neilson of the U.S. Forest Service. MAPSS simulates the natural vegetation that can be supported by any climate at any upland site in the world. Map:GEORGIA: HOTTER AND DRIERA rapidly warming global climate would have significant impact on life across the state, affecting agriculture, rivers, the coast and even the ability of metro Atlanta to attract growth and development. One computer model predicts that as early as 2030, global warming could even force a dramatic change in the region's landscape. That possible change is represented by the shades of green and brown on the map below.CANADIAN MODELIt predicts significant changes in Georgia's ecosystem. Grasslands similar to the Great Plains would replace southern woodlands in much of the state.Map of Georgia indicates the state's principal cities and highways, and principal lakes and riversThree charts are included with the map:IMPACT ON RIVERSChanging temperatures and rainfall would affect the amount of water reaching rivers draining into the South Atlantic and Gulf of Mexico, 1990-2090:Hadley model..… +31%Canadian model… -73%Source: ""Water: The Potential Consequences of Climate Variability and Change for the Water Resources of the United States,"" U.S. Global Change Research ProgramTREES GROW FASTERComputer projections of tree growth, based on the Hadley climate model, predict productivity gains in Southeast forests, thanks in part to additional carbon dioxide in the atmosphere, which acts as a fertilizer. Gains would be greater for hardwoods than for pines because pines require more water...................… 2040....… 2100Pine..............… +11%..........+8%Hardwoods and mixedpine/hardwood..........+22%....… +25%Source: U.S. Forest Service, Southern Global Change ProgramWETTER OR DRIERAnnual rainfall changes projected in the Southeast compared with today's average:..........Hadley model........Canadian model2030..........+3%............… -19%2095....… +22%............… -13%Source: ""Water: The PotentialConsequences of Climate Variability and Change for the Water Resources of the United States,"" U.S. Global Change Research Program Graphic:Brook troutThe brook trout, the only trout native to Georgia, requires cold, clean streams to survive. If global warming occurs as scientists expect, even the most mountainous Georgia streams would be too warm to sustain the fish.Other native speciesOther species native to the state would also be at risk. Along the Georgia coast, rising sea levels threaten beaches on barrier islands where endangered sea turtles lay their eggs. Coastal marshes, which help sustain wading birds such as storks and egrets as well as migratory birds, also would be endangered by the rising sea.The pine forests of South and Middle Georgia are home to a variety of endangered and threatened species, including the red-cockaded woodpecker (right), the indigo snake and the gopher tortoise. If rainfall in the region falls 20 percent, as projected in the Canadian climate model, those pineforest ecosystems and the species they sustain would disappear from the state and perhaps from the planet.MapBROOK TROUT HABITATPresent distribution of brook troutReduced range because of warmingSource: Canadian Journal of Fisheries and Aquatic Sciences Graphic:TIMBER AND FORESTRYManaged forestsTree growers can manipulate fertilizer levels, tree genetics and other factors to help managed forests cope with the impact of global warming.Natural forestsForests growing naturally would be much more vulnerable to drought, pests and other consequences of global warming. Graphic:AGRICULTUREGeorgia farmers would have to adapt to longer periods of drought interspersed with more intense rainfall. But if rainfall declines significantly, the state's farm economy would probably collapse. Graphic:RISING SEA THREATENS COASTLINEIf sea levels rise as expected along the Georgia coast, policymakers will have two options. If they allow the process to occur naturally, the state's coastline will move inland by an average of 100 to 200 yards. Beaches and marshes would rebuild themselves naturally along the new coastline.That policy would be politically controversial because it allows the destruction of private property along the coast. However, it would preserve the beaches that draw hundreds of thousands of tourists to the region and the marshes that sustain the entire coastal ecosystem.The second approach, called armoring, would protect private property from the encroaching ocean because sea walls and bulkheads would be built along the coast. Under that approach, however, beaches and marshes would be trapped between a rising ocean and man-made structures and would all but disappear. The Georgia shoreline would become a long line of rocks and concrete protecting the interior from the ocean.According to either approach, the state's barrier islands and coastal areas would become more vulnerable to storms. Homes and businesses now protected from a storm surge would be flooded if sea levels rose by 2 feet.Diagram illustrates the effect of a rise in sea level of 2 feetGEORGIA'S CHANGING COAST (Not to scale)As the sea level rises and the marshes are flooded, coastal structures such as roads keep the marshes from moving inland.Coastal marshes provide a nursery for many types of sea life, including commercially important species such as shrimp. Birds, crabs, raccoons and larger fish also use the marshes as feeding grounds.The loss of beach and rising water levels make structures on barrier islands more vulnerable to huge waves during tropical storms and hurricanes.A rise of 20 inches in sea level would result in the destruction of the beaches along Georgia's barrier islands.Barrier islandCurrent beachMarshlandMainlandMarshlandRoadbedArmored beachStorm surgeAtlantic OceanIntracoastal WaterwayCurrent sea levelProjected 20-inch rise in sea level Photo:CHANGING ECOSYSTEMIf precipitation in Georgia drops 20 percent by 2030 as predicted in the Canadian climate model, the forests of South and Central Georgia would begin to die back because of drought. Wildfires much like those in Florida (left) the past few years would begin to remake the Georgia landscape, according to one expert. Those fires eventually would transform that region into open grasslands much like those of the Great Plains (right). Photo:"
